{
  "jurisdiction": "INT",
  "earthing_system": "TT",
  "met_location": "meter board, kitchen utility area",
  "available_zs_at_main_db_ohm": 200.0,
  "electrode_target_met": true,
  "supplementary_bonding_locations": [],
  "rcd_protected_circuit_ids": ["F01", "F02", "F03", "F04"],
  "circuits": [
    {
      "circuit_id": "F01",
      "cpc_csa_mm2_or_awg": "1.5mm²",
      "zs_compliance": "pass_with_rcd",
      "rcd_required": true,
      "rcd_type": "AC",
      "rcd_sensitivity_ma": 30
    },
    {
      "circuit_id": "F02",
      "cpc_csa_mm2_or_awg": "2.5mm²",
      "zs_compliance": "pass_with_rcd",
      "rcd_required": true,
      "rcd_type": "A",
      "rcd_sensitivity_ma": 30
    },
    {
      "circuit_id": "F03",
      "cpc_csa_mm2_or_awg": "2.5mm²",
      "zs_compliance": "pass_with_rcd",
      "rcd_required": true,
      "rcd_type": "A",
      "rcd_sensitivity_ma": 30
    },
    {
      "circuit_id": "F04",
      "cpc_csa_mm2_or_awg": "2.5mm²",
      "zs_compliance": "pass_with_rcd",
      "rcd_required": true,
      "rcd_type": "A",
      "rcd_sensitivity_ma": 30
    }
  ],
  "life_safety_bonded_assets": [],
  "compliance_summary": {
    "compliant": true,
    "non_compliance_flag_count": 0
  }
}
